{
  "narration": "Please specify your action or movement.",
  "adjudication": "The input received was not defined or recognizable as an action. Awaiting clarification to proceed.",
  "map_updates": [],
  "state_updates": [],
  "questions": [
    "What action would you like to perform? Please specify your action or movement."
  ]
}