{
  "narration": "Seren steps one square east, approaching the fountain.",
  "adjudication": "Movement: 1 square east. No obstacles.",
  "map_updates": [
    {
      "op": "move_entity",
      "entity_id": "pc-01",
      "from": { "x": 5, "y": 6 },
      "to": { "x": 6, "y": 6 }
    }
  ],
  "state_updates": [
    {
      "op": "set_hp",
      "entity_id": "npc-02",
      "current": 23
    }
  ],
  "questions": []
}
